<?xml version="1.0"?>
<prezidentsky_dekret
     xmlns:xsi="http://www.w3.org/2001/XMLSchema-instance"
     xsi:noNamespaceSchemaLocation="https://github.com/pirati-cz/docs/schema.xsd"
     nazev="Dekret presidenta republiky, kterým se mění a doplňují některá ustanovení vojenského trestního zákona a branného zákona"
     sbirka="1945"
     castka="2"
     cislo="3"
     datum_schvaleni="1945-04-23"
     datum_platnosti="1945-04-30"
     datum_ucinnosti="1945-04-30">
     <paragraf cislo="1">
          Ustanovení § 194 vojenského trestního zákona doplňuje se dalším odstavcem tohoto znění:
          <odstavec cislo="2">
               "(2) Kromě toho v době války propadne zběh trestu smrti zastřelením, uznal-li hlavní velitel pro vzmáhající se zběhnutí za nutné pohroziti tímto trestem i bez vyhlášení stanného práva a uprchl-li zběh přes tuto jemu známou pohrůžku od jakéhokoliv vojenského útvaru v úmyslu, aby se tím vyhnul službě v poli. To platí i tehdy, kdyby jinak zběh nemohl býti odsouzen k trestu smrti, poněvadž se sám dobrovolně dostavil anebo přihlásil (§ 195 a)."
          </odstavec>
          Ustanovení § 294 vojenského trestního zákona se doplňuje dalším odstavcem tohoto znění:
          <odstavec cislo="2">
               "(2) V době války trestá se však zločin tento trestem smrti zastřelením, uznal-li hlavní velitel pro vzmáhající se sebepoškození za nutné i bez vyhlášení stanného práva pohroziti tímto trestem a dopustil-li se pachatel tohoto zločinu přes tuto jemu známou pohrůžku."
          </odstavec>
          Ustanovení § 295 vojenského trestního zákona se doplňuje dalším odstavcem tohoto znění:
          <odstavec cislo="2">
               "(2) V době války trestá se zločin tento žalářem od pěti do deseti let, trestem smrti zastřelením však, uznal-li hlavní velitel pro vzmáhající se sebepoškození za nutné i bez vyhlášení stanného práva pohroziti tímto trestem a dopustil-li se pachatel tohoto zločinu přes tuto jemu známou pohrůžku."
          </odstavec>
     </paragraf>
     <paragraf cislo="2">Trest na svobodě, stanovený § 50 branného zákona Československé republiky ze dne 19. března 1920, č. 193 Sb. z. a n., za neuposlechnutí povolávacího rozkazu k činné službě za mobilisace, zvyšuje se na tuhé vězení do pěti let.</paragraf>
     <paragraf cislo="3">Účinnost tohoto dekretu nastává dnem jeho vyhlášení.</paragraf>
     <paragraf cislo="4">Provedením tohoto dekretu pověřuje se ministr národní obrany.</paragraf>
</prezidentsky_dekret>
